,ICL Prompt,ZSL Prompt,Answer
57,"Classify the news articles into the categories of World, Sports, Business, and Technology.
News: Gaza militants die in Israel raid At least two Palestinian militants are killed in an Israeli missile strike near a Jewish  settlement in southern Gaza.
Category: World
News: Witness recants The prime witness in an alleged coup plot in oil-rich Equatorial Guinea repudiated his confession Tuesday, saying it was coerced by interrogators who threatened him with death.
Category: World
News: No Respite for Microsoft European antitrust regulators extend their review of Microsoft-Time Warner deal. Also: Gateway plans to sell desktops at CompUSA   hellip;. Vodafone's Japanese unit headhunts an executive from rival NTT DoCoMo   hellip;. and more.
Category: Business
News: EU tentatively agrees to lift embargo on Libya BRUSSELS : European Union (EU) officials agreed in principle to lift an arms embargo on Libya after pressure from Italy. Italy has for several months been pressing its EU counterparts to lift the embargo imposed 
Category: World
News: HP, Brocade hook up for integrated servers Hewlett-Packard on Thursday announced that it will integrate Brocade Communication's SAN switching capability into its HP BladeSystem architecture.&lt;p&gt;ADVERTISEMENT&lt;/p&gt;&lt;p&gt;&lt;img src=""http://ad.doubleclick.net/ad/idg.us.ifw.general/sbcspotrssfeed;sz=1x1;ord=200301151450?"" width=""1"" height=""1"" border=""0""/&gt;&lt;a href=""http://ad.doubleclick.net/clk;11714255;9651165;g?http://infoworld.com/spotlights/sbc/main.html?lpid0101035400730403idlp""&gt;SBC Datacomm White Paper&lt;/a&gt;&lt;br/&gt;Find out how Crate   Barrel expects to save \$180,000 by moving to VoIP, compared to a traditional PBX.&lt;/p&gt;
Category:","Classify the news articles into the categories of World, Sports, Business, and Technology.
News: HP, Brocade hook up for integrated servers Hewlett-Packard on Thursday announced that it will integrate Brocade Communication's SAN switching capability into its HP BladeSystem architecture.&lt;p&gt;ADVERTISEMENT&lt;/p&gt;&lt;p&gt;&lt;img src=""http://ad.doubleclick.net/ad/idg.us.ifw.general/sbcspotrssfeed;sz=1x1;ord=200301151450?"" width=""1"" height=""1"" border=""0""/&gt;&lt;a href=""http://ad.doubleclick.net/clk;11714255;9651165;g?http://infoworld.com/spotlights/sbc/main.html?lpid0101035400730403idlp""&gt;SBC Datacomm White Paper&lt;/a&gt;&lt;br/&gt;Find out how Crate   Barrel expects to save \$180,000 by moving to VoIP, compared to a traditional PBX.&lt;/p&gt;
Category:",Technology
58,"Classify the news articles into the categories of World, Sports, Business, and Technology.
News: Baseball rejects DC plan Major League Baseball is poised to cancel the move of the Montreal Expos to Washington after the District of Columbia Council Tuesday night amended the agreement for a riverfront stadium by requiring 50 percent private financing.
Category: Sports
News: 6 turnovers stymie MSU in 31-24 loss to Irish Michigan State looked like a bunch of shamrocks in their green jerseys, pants and helmets, but it couldn #39;t take the luck of the Irish away from Notre Dame Saturday night in Spartan Stadium.
Category: Sports
News: Arroyo plans an inside job Take notice Derek Jeter, Alex Rodriguez, and Gary Sheffield: If you crowd the plate, you are going to hear a symphony of chin music. Or worse, you could get hit with a 90-mile-per-hour fastball in tonight's Game 3 of the American League Championship Series at Fenway Park.
Category: Sports
News: Political split over date threatens Iraq elections An escalating political rift among Iraq #39;s main religious groups and continued violence throughout the country are threatening parliamentary elections set for January.
Category: World
News: Google offers a suggestion Google has launched a new feature that tries to guess what users are looking for as they type queries into its search box. Google Suggest was quietly launched this week in the company #39;s Labs site, which showcases 
Category:","Classify the news articles into the categories of World, Sports, Business, and Technology.
News: Google offers a suggestion Google has launched a new feature that tries to guess what users are looking for as they type queries into its search box. Google Suggest was quietly launched this week in the company #39;s Labs site, which showcases 
Category:",Technology
59,"Classify the news articles into the categories of World, Sports, Business, and Technology.
News: Jimenez Wins Hong Kong Open HONG KONG - Miguel Angel Jimenez won the Hong Kong Open for his fifth European tour title of the year, closing with a 4-under 66 on Sunday for a one-stroke victory over Ryder Cup teammate Padraig Harrington and South Africa #39;s James Kingston.
Category: Sports
News: UPDATE 1-US Air creditors back plan to dump labor contracts Major creditors holding billions in claims on Tuesday supported plans by US Airways (UAIRQ.OB: Quote, Profile, Research) to void labor contracts covering thousands 
Category: Business
News: Tendulkar Test doubt SACHIN Tendulkar will return to India this week with genuine concerns his troublesome elbow will keep him out of next month #39;s showdown with Australia.
Category: Sports
News: Microsoft gets a fashion makeover com October 15, 2004, 5:11 AM PT. Wood paneling and chrome made your dad #39;s station wagon look like a million bucks, and they might also be just the ticket for Microsoft #39;s fledgling 
Category: Technology
News: 1st lawsuit filed against instant-message spam WASHINGTON, Washington, United States of America -- The first known lawsuit against instant-message spam, sometimes called spim, was announced by America Online as part of a campaign to stem unwanted computer messages.
Category:","Classify the news articles into the categories of World, Sports, Business, and Technology.
News: 1st lawsuit filed against instant-message spam WASHINGTON, Washington, United States of America -- The first known lawsuit against instant-message spam, sometimes called spim, was announced by America Online as part of a campaign to stem unwanted computer messages.
Category:",Technology
60,"Classify the news articles into the categories of World, Sports, Business, and Technology.
News: Expanding economy confirmed With the economy continuing to rank as a top factor in the upcoming election, the latest  quot;beige book quot; confirms that economic activity continued to expand through early October.
Category: Business
News: IMF Cuts World '05 Growth Forecast-Source  LONDON (Reuters) - The International Monetary Fund has cut  its forecast for global growth next year slightly amid  expectations that the U.S. and Chinese economies will not  expand as strongly as previously thought.
Category: Business
News: Gas pipeline feeding Arizona reopened A pipeline that supplies Arizona with about 70 percent of its gasoline, diesel and jet fuel was operating again today after being shut down in the aftermath of severe rain in Southern California.
Category: Business
News: Search Engine Forums Spotlight Links to this week's topics from search engine forums across the web: Live from SES Chicago 2004 - White Hat/black Hat SEO Panel - So Now You Can Search Videos - Google Wins Major Legal Victory vs. Geico - Google Suggest Beta - The Dark Side of Exchanging Reciprocal Links
Category: Technology
News: Hunt for Balkan war criminals  #39;likely to fail #39; British defence officials conceded yesterday that military action to bring Serb and Croat war crimes suspects to trial would probably fail because of the sophisticated support network surrounding them.
Category:","Classify the news articles into the categories of World, Sports, Business, and Technology.
News: Hunt for Balkan war criminals  #39;likely to fail #39; British defence officials conceded yesterday that military action to bring Serb and Croat war crimes suspects to trial would probably fail because of the sophisticated support network surrounding them.
Category:",World
61,"Classify the news articles into the categories of World, Sports, Business, and Technology.
News: Trojan Mugs UK Web Banking Customers The Banker-AJ trojan has been coded to lie dormant in the background on infected Windows PCs. When users visit legitimate online banking Web sites of certain UK banks, the malicious code is 
Category: Technology
News: Liverpool set for new bid Liverpool could be about to be taken over by a new suitor, according to reports.
Category: Business
News: Macromedia Delivers Flex Builder Macromedia promises to speed development of Internet applications with a new tool for its Flex platform. With Flex, enterprises can add interfaces to strategic applications, including visual 
Category: Technology
News: Study: Spammers use e-mail ID to gain legitimacy With few junk e-mail filters supporting a protocol for verifying the source address of digital messages, spammers have adopted it themselves as a way to appear more legitimate, stated a report released on Wednesday.
Category: Technology
News: 9 years for spammer Jaynes p2pnet.net News:- Spammer Jeremy Jaynes, aka Gaven Stubberfield, had the distinction of being the first spammer to be charged under Virginia #39;s antispam law.
Category:","Classify the news articles into the categories of World, Sports, Business, and Technology.
News: 9 years for spammer Jaynes p2pnet.net News:- Spammer Jeremy Jaynes, aka Gaven Stubberfield, had the distinction of being the first spammer to be charged under Virginia #39;s antispam law.
Category:",Technology
62,"Classify the news articles into the categories of World, Sports, Business, and Technology.
News: NFL Wrap: Manning Wins MVP Battle as Colts Beat Titans (Reuters) Reuters - Peyton Manning threw for 254 yards and\two touchdowns to win his showdown with fellow co-MVP Steve\McNair as the Indianapolis Colts beat the Tennessee Titans\31-17 at Nashville on Sunday.
Category: Sports
News: Notre Dame Fires Football Coach Notre Dame fired Tyrone Willingham as its football coach today after a 6-5 season that culminated with a 41-10 loss to top-ranked Southern Cal on Saturday night.
Category: World
News: Ugandan Army Kills 25 Rebels in Southern Sudan Uganda #39;s army says its troops and helicopter gunships have attacked a rebel camp in southern Sudan, killing 25 fighters. Army officials say seven members of the rebel Lord #39;s Resistance Army were captured in the operation Saturday.
Category: World
News: Elusive Anschutz Leaves Wide Footprint The billionaire investor is on the cusp of becoming a major presence in Washington with ambitious plans for D.C. United and new ownership of Journal Newspapers Inc.
Category: Business
News: British Airways profits soar British Airways today reported further progress in its recovery as it made a half-year pre-tax profit of 335m, but said higher fuel costs remained a concern.
Category:","Classify the news articles into the categories of World, Sports, Business, and Technology.
News: British Airways profits soar British Airways today reported further progress in its recovery as it made a half-year pre-tax profit of 335m, but said higher fuel costs remained a concern.
Category:",Business
63,"Classify the news articles into the categories of World, Sports, Business, and Technology.
News: A Shrinking Airline Industry Offers Limited Options eonard Robinson, who put in 30 years as a mechanic at Pan American World Airways, has a message for his counterparts at US Airways, Delta, United and other struggling airlines pressing 
Category: Business
News: Nokia pushes hard into smartphone email Finnish mobile device giant Nokia said this week that it will support most widely used methods of pushing email and other information to its smartphones.
Category: Technology
News: Labour to adopt exam plan in manifesto Radical proposals out today that would trigger the biggest shake-up to the secondary school examination system for 60 years are likely to feature in Labour #39;s manifesto for the general election.
Category: Technology
News: Woods looks on target for return to winning ways in 2005 TIGER Woods hinted that his victory at the Target World Challenge on Sunday was a sign that his old self may be set for a return in 2005.
Category: Sports
News: Does new Peoplesoft CEO signal a buyout? The ouster of Craig Conway and the return of Dave Duffield could be a prelude to PeopleSoft accepting Oracle's offer.
Category:","Classify the news articles into the categories of World, Sports, Business, and Technology.
News: Does new Peoplesoft CEO signal a buyout? The ouster of Craig Conway and the return of Dave Duffield could be a prelude to PeopleSoft accepting Oracle's offer.
Category:",Technology
64,"Classify the news articles into the categories of World, Sports, Business, and Technology.
News: They fall in love despite social gap, distance He was a young lieutenant, she was the daughter of a general. But the difference in status didn #39;t stop Indonesia #39;s first couple from marrying.
Category: World
News: State reduces stake in Air France The French government sells 17.7 of its stake in Air France-KLM amid reports it may cut its holding in the airline to as little as 18.
Category: Business
News: Report: Delta to Slash Fares  NEW YORK (Reuters) - Delta Air Lines Inc. &lt;A HREF=""http://www.investor.reuters.com/FullQuote.aspx?ticker=DAL.N target=/stocks/quickinfo/fullquote""&gt;DAL.N&lt;/A&gt;, the No.  3 U.S. carrier which has been restructuring in efforts to avoid  a bankruptcy filing, is expected to slash fares and remove  restrictive rules such as Saturday-night stays, Time magazine  reported in its online edition on Sunday.
Category: Business
News: Forecasters See No Repeat of 80s Oil Bust (Reuters) Reuters - A team of market forecasters that\correctly predicted the oil bust of the 1980s thinks history\will not repeat itself, at least for now.
Category: Business
News: Spam Law Test A year after Congress enacted the CAN-SPAM legislation, our tests show that unsubscribing from marketing e-mail can still be hard.
Category:","Classify the news articles into the categories of World, Sports, Business, and Technology.
News: Spam Law Test A year after Congress enacted the CAN-SPAM legislation, our tests show that unsubscribing from marketing e-mail can still be hard.
Category:",Technology
65,"Classify the news articles into the categories of World, Sports, Business, and Technology.
News: UPDATE 1-Five-wicket Gillespie puts Australia in control Jason Gillespie captured five wickets as Australia bowled India out for a paltry 185 to take a commanding 213-run lead on the third day of the third test on Thursday.
Category: Sports
News: No word on trapped China miners A gas explosion in a state-owned mine in China has left 166 miners trapped underground with no means of contact. Nearly 300 miners were in Chenjiashan mine in Shaanxi province when the blast happened on Sunday morning, but 127 escaped, said state media.
Category: World
News: Search Spotlight Pans to Video After years of taking a back seat to easier-to-crawl HTML pages, multimedia files are beginning to gain respect among search engines.
Category: Technology
News: Consumer Prices Climb; Jobless Claims Up Consumer prices rose just 0.1 percent in August, a sign that inflation poses no immediate risk to the economy. The over-the-month-increase in the Consumer Price Index, the government #39;s most closely watched 
Category: Business
News: Oil Rebounds After 8-Day Slide on Blaze  LONDON (Reuters) - Oil prices rose on Wednesday, stemming  an eight-session slide that has dragged prices down 14 percent  from record highs as news emerged of a fresh pipeline fire in  Iraq.
Category:","Classify the news articles into the categories of World, Sports, Business, and Technology.
News: Oil Rebounds After 8-Day Slide on Blaze  LONDON (Reuters) - Oil prices rose on Wednesday, stemming  an eight-session slide that has dragged prices down 14 percent  from record highs as news emerged of a fresh pipeline fire in  Iraq.
Category:",Business
66,"Classify the news articles into the categories of World, Sports, Business, and Technology.
News: Dollar Weakens on Sense of Economic Gloom  NEW YORK (Reuters) - The dollar weakened across the board  on Thursday, forging new lows as a deepening sense of gloom  over the U.S. economic and external deficit picture weighed on  sentiment, analysts said.
Category: Business
News: Time on Jones #39;s side Even if indicted BALCO chief Victor Conte has the doping goods on sprinter Marion Jones, it #39;s unclear whether the International Olympic Committee can revoke the five medals she won in Sydney in 2000.
Category: Sports
News: Clearing The Path For Longhorn Microsoft (Quote, Chart) had little choice but to cut features from Longhorn, its next-generation operating system, analysts and developers say.
Category: Technology
News: Decision near Jim Leyland #39;s brief flirtation with the Mets officially ended yesterday, and general manager Omar Minaya is prepared to select a manager after today #39;s second round of interviews with Willie Randolph, Rudy Jaramillo and Terry Collins.
Category: Sports
News: It #39;s Decision Time for Nets #39; Collins Jason Collins has until Oct. 31 to sign a contract extension with the Nets. If Collins, a 7-foot center, cannot come to an agreement with the team by then, he cannot negotiate 
Category:","Classify the news articles into the categories of World, Sports, Business, and Technology.
News: It #39;s Decision Time for Nets #39; Collins Jason Collins has until Oct. 31 to sign a contract extension with the Nets. If Collins, a 7-foot center, cannot come to an agreement with the team by then, he cannot negotiate 
Category:",Sports
67,"Classify the news articles into the categories of World, Sports, Business, and Technology.
News: Spaniards can lift Liverpool: Benitez Liverpool manager Rafael Benitez insists his new Spanish signings will help the Reds to become contenders for the English Premiership crown.
Category: Sports
News: US troops closing in on central Fallujah There are reports that US troops and crack Iraqi soldiers have surged into rubble-strewn districts in the heart of Fallujah, seizing one third of the city after hours of street fighting with rebels.
Category: World
News: Russia Agrees to Write Off Iraqi Debt to Paris Club Russia agreed on Sunday to forgive up to 80 percent of Iraqs debts to the Paris Club (about \$33 billion). A US Treasury official quoted by Reuters said they received this information from Russia.
Category: World
News: Oil eases as Brent price falls to \$41 a barrel LONDON SEPTEMBER 6: Oil prices eased on Monday as speculative funds continued to take profits but a tight global supply picture stopped the selling from gaining much momentum.
Category: Business
News: ISA Flaw Shows Way In To Phishing Attacks Microsoft ISA and Proxy Server are prone to an Internet domain name spoofing vulnerability that could allow an attacker to spoof Internet sites.
Category:","Classify the news articles into the categories of World, Sports, Business, and Technology.
News: ISA Flaw Shows Way In To Phishing Attacks Microsoft ISA and Proxy Server are prone to an Internet domain name spoofing vulnerability that could allow an attacker to spoof Internet sites.
Category:",Technology
68,"Classify the news articles into the categories of World, Sports, Business, and Technology.
News: Damning report on EU economic ambitions under fire BRUSSELS - European Union leaders got a wake up call this week as a high-level report warned the bloc must run just to stand still in global competitiveness rankings.
Category: Business
News: Indians finishing like they started MINNEAPOLIS -- It was  #39; #39;Scott Elarton Continued Employment Night #39; #39; at the Metrodome yesterday, as the elongated right-hander made a final bid for a spot on the Indians #39; roster for 2005.
Category: Sports
News: IBM's PC unit lost money from 2001 onwards IBM's personal computer business racked up \$965 million in losses between Jan. 1, 2001, and June 30, 2004, the company said last week in a filing to the U.S. Securities and Exchange Commission, detailing the planned sale of the business to China's Lenovo Group.
Category: Technology
News: Google Now Indexing Up to Six Url Variables Google Now Indexing Up to Six Url Variables\\Some great news for those stressing over whether Google will be able to spider their very long dynamic urls. Appears in the last couple weeks Google has been pushing the envelope in terms of spidering urls that contain more than 5 variables and ...
Category: Technology
News: Microsoft awaits penalties timing Microsoft is expected to hear next month whether antitrust penalties imposed by the European Commission will become effective immediately, or whether they will be suspended for possibly four to five years.
Category:","Classify the news articles into the categories of World, Sports, Business, and Technology.
News: Microsoft awaits penalties timing Microsoft is expected to hear next month whether antitrust penalties imposed by the European Commission will become effective immediately, or whether they will be suspended for possibly four to five years.
Category:",Business
69,"Classify the news articles into the categories of World, Sports, Business, and Technology.
News: Vulnerability hits Java for cell phones Researcher finds two flaws that under unusual circumstances could let a malicious program read private data or render a phone unusable.
Category: Technology
News: UK to Send Troops Into US-Controlled Area of Iraq (Update1) UK Prime Minister Tony Blair #39;s government, risking criticism from lawmakers in the ruling Labour Party, said it will redeploy 850 troops now in southern Iraq to a region controlled by US forces.
Category: World
News: Miniature People Add Extra Pieces to Evolutionary Puzzle The miniature people found to have lived on an Indonesian island until 13,000 years ago have shaken up views of the human past.
Category: Technology
News: Marsh Talks to Spitzer About Settling Independent directors of Marsh   McLennan Cos. approached New York state Attorney General Eliot L. Spitzer this week about settling the corruption charges Spitzer has brought against the giant insurance broker and financial services firm, according to sources close to the investigation.
Category: Business
News: Howard seeks apology over Liverpool article LONDON: The leader of Britain #39;s main opposition party yesterday ordered a legislator to apologise for a magazine article that depicted the people of Liverpool as sentimental victims who nurse a  quot;tribal grievance quot; against the rest of society.
Category:","Classify the news articles into the categories of World, Sports, Business, and Technology.
News: Howard seeks apology over Liverpool article LONDON: The leader of Britain #39;s main opposition party yesterday ordered a legislator to apologise for a magazine article that depicted the people of Liverpool as sentimental victims who nurse a  quot;tribal grievance quot; against the rest of society.
Category:",World
70,"Classify the news articles into the categories of World, Sports, Business, and Technology.
News: Pacers Want Artest Tuned In on Court Instead of Off It Jermaine O #39;Neal was sick and tired of talking about it: Ron Artest, the hip-hop record, the three-day distraction that exploded into a tragicomic controversy heard round the NBA.
Category: Sports
News: OAUG pushes on collaboration with Oracle, other users groups SEPTEMBER 09, 2004 (COMPUTERWORLD) - The Oracle Application User Group (OAUG) plans to hold its Connection Point 2004 annual user conference next week in Orlando, with an emphasis on educating members about the 10g database and 11i.
Category: Technology
News: IPass To Offer Flat-Rate Hotspot Pricing Aggregator says it expects flat-rate pricing to simplify budgeting for enterprises and to increase usage of hotspots. By Mobile Pipeline News.
Category: Technology
News: Martyn defies rampant India India ended the fourth day needing 210 more runs to win this multi-stranded epic of a second Test and level the series against Australia.
Category: Sports
News: Jobless Claims Rise on Hurricanes  WASHINGTON (Reuters) - The number of Americans seeking  initial jobless benefits jumped by 18,000 last week, the  government said on Thursday, but it attributed the entire rise  to the effects of hurricanes that have battered the southern  United States.
Category:","Classify the news articles into the categories of World, Sports, Business, and Technology.
News: Jobless Claims Rise on Hurricanes  WASHINGTON (Reuters) - The number of Americans seeking  initial jobless benefits jumped by 18,000 last week, the  government said on Thursday, but it attributed the entire rise  to the effects of hurricanes that have battered the southern  United States.
Category:",Business
